{
  "$schema": "../../gimg/schemas/project-config.schema.json",
  "minVersion": "0.1.0",
  "name": "toveriai",
  "delivery": {
    "dir": "entrega",
    "template": "{key}-{profile}.png"
  },
  "profiles": {
    "og": {
      "width": 1280,
      "height": 640,
      "steps": 6,
      "cfg": 1.0,
      "sampler": "euler",
      "model": "flux2-klein-4b-q8"
    },
    "square": {
      "width": 1024,
      "height": 1024,
      "steps": 6,
      "cfg": 1.0,
      "sampler": "euler",
      "model": "flux2-klein-4b-q8"
    },
    "portrait": {
      "width": 896,
      "height": 1152,
      "steps": 6,
      "cfg": 1.0,
      "sampler": "euler",
      "model": "flux2-klein-4b-q8"
    },
    "wide": {
      "width": 1280,
      "height": 768,
      "steps": 6,
      "cfg": 1.0,
      "sampler": "euler",
      "model": "flux2-klein-4b-q8"
    },
    "header": {
      "width": 1536,
      "height": 512,
      "steps": 6,
      "cfg": 1.0,
      "sampler": "euler",
      "model": "flux2-klein-4b-q8"
    }
  }
}
